No,Timestamp,Source,Destination,Protocal,length,info
1,1667130235.606706000,192.168.31.246,192.168.31.2,dns,91," Transaction ID: 0x1033| Flags: 0x0100 Standard query| 0... .... .... .... = Response: Message is a query| .000 0... .... .... = Opcode: Standard query (0)| .... ..0. .... .... = Truncated: Message is not truncated| .... ...1 .... .... = Recursion desired: Do query recursively| .... .... .0.. .... = Z: reserved (0)| .... .... ...0 .... = Non-authenticated data: Unacceptable| Questions: 1| Answer RRs: 0| Authority RRs: 0| Additional RRs: 0| Queries| Name: settings-win.data.microsoft.com| Name Length: 31| Label Count: 4| Type: A (Host Address) (1)| Class: IN (0x0001)| settings-win.data.microsoft.com: type A, class IN|"
4,1667130235.720864000,192.168.31.2,192.168.31.246,dns,227," Transaction ID: 0x1033| Flags: 0x8180 Standard query response, No error| 1... .... .... .... = Response: Message is a response| .000 0... .... .... = Opcode: Standard query (0)| .... .0.. .... .... = Authoritative: Server is not an authority for domain| .... ..0. .... .... = Truncated: Message is not truncated| .... ...1 .... .... = Recursion desired: Do query recursively| .... .... 1... .... = Recursion available: Server can do recursive queries| .... .... .0.. .... = Z: reserved (0)| .... .... ..0. .... = Answer authenticated: Answer/authority portion was not authenticated by the server| .... .... ...0 .... = Non-authenticated data: Unacceptable| .... .... .... 0000 = Reply code: No error (0)| Questions: 1| Answer RRs: 3| Authority RRs: 0| Additional RRs: 0| Queries| Name: settings-win.data.microsoft.com| Name Length: 31| Label Count: 4| Type: A (Host Address) (1)| Class: IN (0x0001)| Name: settings-win.data.microsoft.com| Type: CNAME (Canonical NAME for an alias) (5)| Class: IN (0x0001)| Time to live: 5 (5 seconds)| Data length: 45| CNAME: atm-settingsfe-prod-geo2.trafficmanager.net| Address: 20.44.239.154| Request In: 1| Time: 0.114158000 seconds| settings-win.data.microsoft.com: type A, class IN| Answers| settings-win.data.microsoft.com: type CNAME, class IN, cname atm-settingsfe-prod-geo2.trafficmanager.net| atm-settingsfe-prod-geo2.trafficmanager.net: type CNAME, class IN, cname settings-prod-sea-1.southeastasia.cloudapp.azure.com| settings-prod-sea-1.southeastasia.cloudapp.azure.com: type A, class IN, addr 20.44.239.154| Name: atm-settingsfe-prod-geo2.trafficmanager.net| Name: settings-prod-sea-1.southeastasia.cloudapp.azure.com| Type: CNAME (Canonical NAME for an alias) (5)| Type: A (Host Address) (1)| Class: IN (0x0001)| Class: IN (0x0001)| Time to live: 5 (5 seconds)| Time to live: 5 (5 seconds)| Data length: 51| Data length: 4| CNAME: settings-prod-sea-1.southeastasia.cloudapp.azure.com|"
5,1667130235.721489000,192.168.31.246,20.44.239.154,tcp,66," Source Port: 49771| Destination Port: 443| Stream index: 0| TCP Segment Len: 0| Sequence Number: 0    (relative sequence number)| Sequence Number (raw): 3428502639| Next Sequence Number: 1    (relative sequence number)| Acknowledgment Number: 0| Acknowledgment number (raw): 0| 1000 .... = Header Length: 32 bytes (8)| Flags: 0x002 (SYN)| 000. .... .... = Reserved: Not set| ...0 .... .... = Nonce: Not set| .... 0... .... = Congestion Window Reduced (CWR): Not set| .... .0.. .... = ECN-Echo: Not set| .... ..0. .... = Urgent: Not set| .... ...0 .... = Acknowledgment: Not set| .... .... 0... = Push: Not set| .... .... .0.. = Reset: Not set| .... .... ..1. = Syn: Set| Expert Info (Chat/Sequence): Connection establish request (SYN): server port 443| Connection establish request (SYN): server port 443| Severity level: Chat| Group: Sequence| .... .... ...0 = Fin: Not set| TCP Flags: ииииииииииSи| Window: 64240| Calculated window size: 64240| Checksum: 0x32c9 [unverified]| Checksum Status: Unverified| Urgent Pointer: 0| Options: (12 bytes), Maximum segment size, No-Operation (NOP), Window scale, No-Operation (NOP), No-Operation (NOP), SACK permitted| TCP Option - Maximum segment size: 1460 bytes| Kind: Maximum Segment Size (2)| Length: 4| MSS Value: 1460| TCP Option - No-Operation (NOP)| TCP Option - Window scale: 8 (multiply by 256)| Shift count: 8| Multiplier: 256| TCP Option - SACK permitted| Timestamps| Time since first frame in this TCP stream: 0.000000000 seconds| Time since previous frame in this TCP stream: 0.000000000 seconds| Kind: No-Operation (1)| Kind: Window Scale (3)| Kind: No-Operation (1)| Kind: No-Operation (1)| Kind: SACK Permitted (4)| Length: 3| Length: 2| TCP Option - No-Operation (NOP)| TCP Option - No-Operation (NOP)|"
6,1667130235.746104000,20.44.239.154,192.168.31.246,tcp,58," Source Port: 443| Destination Port: 49771| Stream index: 0| TCP Segment Len: 0| Sequence Number: 0    (relative sequence number)| Sequence Number (raw): 1349599240| Next Sequence Number: 1    (relative sequence number)| Acknowledgment Number: 1    (relative ack number)| Acknowledgment number (raw): 3428502640| 0110 .... = Header Length: 24 bytes (6)| Flags: 0x012 (SYN, ACK)| 000. .... .... = Reserved: Not set| ...0 .... .... = Nonce: Not set| .... 0... .... = Congestion Window Reduced (CWR): Not set| .... .0.. .... = ECN-Echo: Not set| .... ..0. .... = Urgent: Not set| .... ...1 .... = Acknowledgment: Set| .... .... 0... = Push: Not set| .... .... .0.. = Reset: Not set| .... .... ..1. = Syn: Set| Expert Info (Chat/Sequence): Connection establish acknowledge (SYN+ACK): server port 443| Connection establish acknowledge (SYN+ACK): server port 443| Severity level: Chat| Group: Sequence| .... .... ...0 = Fin: Not set| TCP Flags: иииииииAииSи| Window: 64240| Calculated window size: 64240| Checksum: 0xcb54 [unverified]| Checksum Status: Unverified| Urgent Pointer: 0| Options: (4 bytes), Maximum segment size| TCP Option - Maximum segment size: 1460 bytes| Kind: Maximum Segment Size (2)| Length: 4| MSS Value: 1460| SEQ/ACK analysis| This is an ACK to the segment in frame: 5| The RTT to ACK the segment was: 0.024615000 seconds| Timestamps| Time since first frame in this TCP stream: 0.024615000 seconds| Time since previous frame in this TCP stream: 0.024615000 seconds|"
7,1667130235.746311000,192.168.31.246,20.44.239.154,tcp,54, Source Port: 49771| Destination Port: 443| Stream index: 0| TCP Segment Len: 0| Sequence Number: 1    (relative sequence number)| Sequence Number (raw): 3428502640| Next Sequence Number: 1    (relative sequence number)| Acknowledgment Number: 1    (relative ack number)| Acknowledgment number (raw): 1349599241| 0101 .... = Header Length: 20 bytes (5)| Flags: 0x010 (ACK)| 000. .... .... = Reserved: Not set| ...0 .... .... = Nonce: Not set| .... 0... .... = Congestion Window Reduced (CWR): Not set| .... .0.. .... = ECN-Echo: Not set| .... ..0. .... = Urgent: Not set| .... ...1 .... = Acknowledgment: Set| .... .... 0... = Push: Not set| .... .... .0.. = Reset: Not set| .... .... ..0. = Syn: Not set| .... .... ...0 = Fin: Not set| TCP Flags: иииииииAииии| Window: 64240| Calculated window size: 64240| Window size scaling factor: -2 (no window scaling used)| Checksum: 0xe311 [unverified]| Checksum Status: Unverified| Urgent Pointer: 0| SEQ/ACK analysis| This is an ACK to the segment in frame: 6| The RTT to ACK the segment was: 0.000207000 seconds| iRTT: 0.024822000 seconds| Timestamps| Time since first frame in this TCP stream: 0.024822000 seconds| Time since previous frame in this TCP stream: 0.000207000 seconds|
8,1667130235.746751000,192.168.31.246,20.44.239.154,tls,270," TLSv1.2 Record Layer: Handshake Protocol: Client Hello| Content Type: Handshake (22)| Version: TLS 1.2 (0x0303)| Length: 211| Handshake Protocol: Client Hello| Handshake Type: Client Hello (1)| Length: 207| Version: TLS 1.2 (0x0303)| Random: 635e637b80e69d62dd2c478adbca209af81cbcb1e466fb66e7042c53c6674bcc| GMT Unix Time: Oct 30, 2022 18:43:55.000000000 SE Asia Standard Time| Random Bytes: 80e69d62dd2c478adbca209af81cbcb1e466fb66e7042c53c6674bcc| Session ID Length: 0| Cipher Suites Length: 38| Cipher Suites (19 suites)| Cipher Suite: TLS_ECDHE_ECDSA_WITH_AES_256_GCM_SHA384 (0xc02c)| Compression Methods Length: 1| Compression Methods (1 method)| Compression Method: null (0)| Extensions Length: 128| Extension: server_name (len=36)| Type: server_name (0)| Length: 36| Server Name list length: 34| Server Name Type: host_name (0)| Server Name length: 31| Server Name: settings-win.data.microsoft.com| Certificate Status Type: OCSP (1)| Responder ID list Length: 0| Request Extensions Length: 0| Supported Groups List Length: 6| Supported Groups (3 groups)| Supported Group: x25519 (0x001d)| EC point formats Length: 1| Elliptic curves point formats (1)| EC point format: uncompressed (0)| Signature Hash Algorithms Length: 24| Signature Hash Algorithms (12 algorithms)| Signature Algorithm: rsa_pss_rsae_sha256 (0x0804)| Signature Hash Algorithm Hash: Unknown (8)| Signature Hash Algorithm Signature: Unknown (4)| Data (0 bytes)| ALPN Extension Length: 12| ALPN Protocol| ALPN string length: 2| ALPN Next Protocol: h2| Renegotiation info extension length: 0| Cipher Suite: TLS_ECDHE_ECDSA_WITH_AES_128_GCM_SHA256 (0xc02b)| Cipher Suite: TLS_ECDHE_RSA_WITH_AES_256_GCM_SHA384 (0xc030)| Cipher Suite: TLS_ECDHE_RSA_WITH_AES_128_GCM_SHA256 (0xc02f)| Cipher Suite: TLS_ECDHE_ECDSA_WITH_AES_256_CBC_SHA384 (0xc024)| Cipher Suite: TLS_ECDHE_ECDSA_WITH_AES_128_CBC_SHA256 (0xc023)| Cipher Suite: TLS_ECDHE_RSA_WITH_AES_256_CBC_SHA384 (0xc028)| Cipher Suite: TLS_ECDHE_RSA_WITH_AES_128_CBC_SHA256 (0xc027)| Cipher Suite: TLS_ECDHE_ECDSA_WITH_AES_256_CBC_SHA (0xc00a)| Cipher Suite: TLS_ECDHE_ECDSA_WITH_AES_128_CBC_SHA (0xc009)| Cipher Suite: TLS_ECDHE_RSA_WITH_AES_256_CBC_SHA (0xc014)| Cipher Suite: TLS_ECDHE_RSA_WITH_AES_128_CBC_SHA (0xc013)| Cipher Suite: TLS_RSA_WITH_AES_256_GCM_SHA384 (0x009d)| Cipher Suite: TLS_RSA_WITH_AES_128_GCM_SHA256 (0x009c)| Cipher Suite: TLS_RSA_WITH_AES_256_CBC_SHA256 (0x003d)| Cipher Suite: TLS_RSA_WITH_AES_128_CBC_SHA256 (0x003c)| Cipher Suite: TLS_RSA_WITH_AES_256_CBC_SHA (0x0035)| Cipher Suite: TLS_RSA_WITH_AES_128_CBC_SHA (0x002f)| Cipher Suite: TLS_RSA_WITH_3DES_EDE_CBC_SHA (0x000a)| Server Name Indication extension| Extension: status_request (len=5)| Extension: supported_groups (len=8)| Extension: ec_point_formats (len=2)| Extension: signature_algorithms (len=26)| Extension: session_ticket (len=0)| Extension: application_layer_protocol_negotiation (len=14)| Extension: extended_master_secret (len=0)| Extension: renegotiation_info (len=1)| Renegotiation Info extension| Type: status_request (5)| Type: supported_groups (10)| Type: ec_point_formats (11)| Type: signature_algorithms (13)| Type: session_ticket (35)| Type: application_layer_protocol_negotiation (16)| Type: extended_master_secret (23)| Type: renegotiation_info (65281)| Length: 5| Length: 8| Length: 2| Length: 26| Length: 0| Length: 14| Length: 0| Length: 1| Supported Group: secp256r1 (0x0017)| Supported Group: secp384r1 (0x0018)| Signature Algorithm: rsa_pss_rsae_sha384 (0x0805)| Signature Algorithm: rsa_pss_rsae_sha512 (0x0806)| Signature Algorithm: rsa_pkcs1_sha256 (0x0401)| Signature Algorithm: rsa_pkcs1_sha384 (0x0501)| Signature Algorithm: rsa_pkcs1_sha1 (0x0201)| Signature Algorithm: ecdsa_secp256r1_sha256 (0x0403)| Signature Algorithm: ecdsa_secp384r1_sha384 (0x0503)| Signature Algorithm: ecdsa_sha1 (0x0203)| Signature Algorithm: SHA1 DSA (0x0202)| Signature Algorithm: rsa_pkcs1_sha512 (0x0601)| Signature Algorithm: ecdsa_secp521r1_sha512 (0x0603)| Signature Hash Algorithm Hash: Unknown (8)| Signature Hash Algorithm Hash: Unknown (8)| Signature Hash Algorithm Hash: SHA256 (4)| Signature Hash Algorithm Hash: SHA384 (5)| Signature Hash Algorithm Hash: SHA1 (2)| Signature Hash Algorithm Hash: SHA256 (4)| Signature Hash Algorithm Hash: SHA384 (5)| Signature Hash Algorithm Hash: SHA1 (2)| Signature Hash Algorithm Hash: SHA1 (2)| Signature Hash Algorithm Hash: SHA512 (6)| Signature Hash Algorithm Hash: SHA512 (6)| Signature Hash Algorithm Signature: Unknown (5)| Signature Hash Algorithm Signature: Unknown (6)| Signature Hash Algorithm Signature: RSA (1)| Signature Hash Algorithm Signature: RSA (1)| Signature Hash Algorithm Signature: RSA (1)| Signature Hash Algorithm Signature: ECDSA (3)| Signature Hash Algorithm Signature: ECDSA (3)| Signature Hash Algorithm Signature: ECDSA (3)| Signature Hash Algorithm Signature: DSA (2)| Signature Hash Algorithm Signature: RSA (1)| Signature Hash Algorithm Signature: ECDSA (3)| ALPN string length: 8| ALPN Next Protocol: http/1.1|"
9,1667130235.746926000,20.44.239.154,192.168.31.246,tcp,54, Source Port: 443| Destination Port: 49771| Stream index: 0| TCP Segment Len: 0| Sequence Number: 1    (relative sequence number)| Sequence Number (raw): 1349599241| Next Sequence Number: 1    (relative sequence number)| Acknowledgment Number: 217    (relative ack number)| Acknowledgment number (raw): 3428502856| 0101 .... = Header Length: 20 bytes (5)| Flags: 0x010 (ACK)| 000. .... .... = Reserved: Not set| ...0 .... .... = Nonce: Not set| .... 0... .... = Congestion Window Reduced (CWR): Not set| .... .0.. .... = ECN-Echo: Not set| .... ..0. .... = Urgent: Not set| .... ...1 .... = Acknowledgment: Set| .... .... 0... = Push: Not set| .... .... .0.. = Reset: Not set| .... .... ..0. = Syn: Not set| .... .... ...0 = Fin: Not set| TCP Flags: иииииииAииии| Window: 64240| Calculated window size: 64240| Window size scaling factor: -2 (no window scaling used)| Checksum: 0xe239 [unverified]| Checksum Status: Unverified| Urgent Pointer: 0| SEQ/ACK analysis| This is an ACK to the segment in frame: 8| The RTT to ACK the segment was: 0.000175000 seconds| iRTT: 0.024822000 seconds| Timestamps| Time since first frame in this TCP stream: 0.025437000 seconds| Time since previous frame in this TCP stream: 0.000175000 seconds|
10,1667130235.776739000,20.44.239.154,192.168.31.246,tls,1514,
11,1667130235.776759000,20.44.239.154,192.168.31.246,tcp,1514, Source Port: 443| Destination Port: 49771| Stream index: 0| TCP Segment Len: 1460| Sequence Number: 1461    (relative sequence number)| Sequence Number (raw): 1349600701| Next Sequence Number: 2921    (relative sequence number)| Acknowledgment Number: 217    (relative ack number)| Acknowledgment number (raw): 3428502856| 0101 .... = Header Length: 20 bytes (5)| Flags: 0x010 (ACK)| 000. .... .... = Reserved: Not set| ...0 .... .... = Nonce: Not set| .... 0... .... = Congestion Window Reduced (CWR): Not set| .... .0.. .... = ECN-Echo: Not set| .... ..0. .... = Urgent: Not set| .... ...1 .... = Acknowledgment: Set| .... .... 0... = Push: Not set| .... .... .0.. = Reset: Not set| .... .... ..0. = Syn: Not set| .... .... ...0 = Fin: Not set| TCP Flags: иииииииAииии| Window: 64240| Calculated window size: 64240| Window size scaling factor: -2 (no window scaling used)| Checksum: 0x42ee [unverified]| Checksum Status: Unverified| Urgent Pointer: 0| SEQ/ACK analysis| iRTT: 0.024822000 seconds| Bytes in flight: 2920| Bytes sent since last PSH flag: 2920| Timestamps| Time since first frame in this TCP stream: 0.055270000 seconds| Time since previous frame in this TCP stream: 0.000020000 seconds| TCP payload (1460 bytes)| TCP segment data (1460 bytes)|
12,1667130235.776771000,20.44.239.154,192.168.31.246,pkix1implicit,892, 
13,1667130235.776961000,192.168.31.246,20.44.239.154,tcp,54, Source Port: 49771| Destination Port: 443| Stream index: 0| TCP Segment Len: 0| Sequence Number: 217    (relative sequence number)| Sequence Number (raw): 3428502856| Next Sequence Number: 217    (relative sequence number)| Acknowledgment Number: 3759    (relative ack number)| Acknowledgment number (raw): 1349602999| 0101 .... = Header Length: 20 bytes (5)| Flags: 0x010 (ACK)| 000. .... .... = Reserved: Not set| ...0 .... .... = Nonce: Not set| .... 0... .... = Congestion Window Reduced (CWR): Not set| .... .0.. .... = ECN-Echo: Not set| .... ..0. .... = Urgent: Not set| .... ...1 .... = Acknowledgment: Set| .... .... 0... = Push: Not set| .... .... .0.. = Reset: Not set| .... .... ..0. = Syn: Not set| .... .... ...0 = Fin: Not set| TCP Flags: иииииииAииии| Window: 64240| Calculated window size: 64240| Window size scaling factor: -2 (no window scaling used)| Checksum: 0xd38b [unverified]| Checksum Status: Unverified| Urgent Pointer: 0| SEQ/ACK analysis| This is an ACK to the segment in frame: 12| The RTT to ACK the segment was: 0.000190000 seconds| iRTT: 0.024822000 seconds| Timestamps| Time since first frame in this TCP stream: 0.055472000 seconds| Time since previous frame in this TCP stream: 0.000190000 seconds|
14,1667130235.779617000,192.168.31.246,20.44.239.154,tls,212, TLSv1.2 Record Layer: Handshake Protocol: Client Key Exchange| Content Type: Handshake (22)| Version: TLS 1.2 (0x0303)| Length: 102| Handshake Protocol: Client Key Exchange| Handshake Type: Client Key Exchange (16)| Length: 98| EC Diffie-Hellman Client Params| Pubkey Length: 97| Pubkey: 04f4b101b0ffd08bc05fc280727c685dacb49d7bc11ee80b5bcef23b933350176abc92e9Ё| Change Cipher Spec Message| TLSv1.2 Record Layer: Change Cipher Spec Protocol: Change Cipher Spec| TLSv1.2 Record Layer: Handshake Protocol: Encrypted Handshake Message| Content Type: Change Cipher Spec (20)| Content Type: Handshake (22)| Version: TLS 1.2 (0x0303)| Version: TLS 1.2 (0x0303)| Length: 1| Length: 40| Handshake Protocol: Encrypted Handshake Message|
15,1667130235.779715000,20.44.239.154,192.168.31.246,tcp,54, Source Port: 443| Destination Port: 49771| Stream index: 0| TCP Segment Len: 0| Sequence Number: 3759    (relative sequence number)| Sequence Number (raw): 1349602999| Next Sequence Number: 3759    (relative sequence number)| Acknowledgment Number: 375    (relative ack number)| Acknowledgment number (raw): 3428503014| 0101 .... = Header Length: 20 bytes (5)| Flags: 0x010 (ACK)| 000. .... .... = Reserved: Not set| ...0 .... .... = Nonce: Not set| .... 0... .... = Congestion Window Reduced (CWR): Not set| .... .0.. .... = ECN-Echo: Not set| .... ..0. .... = Urgent: Not set| .... ...1 .... = Acknowledgment: Set| .... .... 0... = Push: Not set| .... .... .0.. = Reset: Not set| .... .... ..0. = Syn: Not set| .... .... ...0 = Fin: Not set| TCP Flags: иииииииAииии| Window: 64240| Calculated window size: 64240| Window size scaling factor: -2 (no window scaling used)| Checksum: 0xd2ed [unverified]| Checksum Status: Unverified| Urgent Pointer: 0| SEQ/ACK analysis| This is an ACK to the segment in frame: 14| The RTT to ACK the segment was: 0.000098000 seconds| iRTT: 0.024822000 seconds| Timestamps| Time since first frame in this TCP stream: 0.058226000 seconds| Time since previous frame in this TCP stream: 0.000098000 seconds|
16,1667130235.805579000,20.44.239.154,192.168.31.246,tls,174, TLSv1.2 Record Layer: Change Cipher Spec Protocol: Change Cipher Spec| Content Type: Change Cipher Spec (20)| Version: TLS 1.2 (0x0303)| Length: 1| Change Cipher Spec Message| Handshake Protocol: Encrypted Handshake Message| Encrypted Application Data: 0000000000000001febc421ab433c25a3db044d17624377699f9e3c54c1529213a5cae94Ё| Application Data Protocol: http2| TLSv1.2 Record Layer: Handshake Protocol: Encrypted Handshake Message| TLSv1.2 Record Layer: Application Data Protocol: http2| Content Type: Handshake (22)| Content Type: Application Data (23)| Version: TLS 1.2 (0x0303)| Version: TLS 1.2 (0x0303)| Length: 40| Length: 64|
17,1667130235.806621000,192.168.31.246,20.44.239.154,tls,141, TLSv1.2 Record Layer: Application Data Protocol: http2| Content Type: Application Data (23)| Version: TLS 1.2 (0x0303)| Length: 82| Encrypted Application Data: 0000000000000001f5961383a669d0be425d43632b6c2fd2137a6c3fb7f725cfe1f77809Ё| Application Data Protocol: http2|
18,1667130235.806672000,20.44.239.154,192.168.31.246,tcp,54, Source Port: 443| Destination Port: 49771| Stream index: 0| TCP Segment Len: 0| Sequence Number: 3879    (relative sequence number)| Sequence Number (raw): 1349603119| Next Sequence Number: 3879    (relative sequence number)| Acknowledgment Number: 462    (relative ack number)| Acknowledgment number (raw): 3428503101| 0101 .... = Header Length: 20 bytes (5)| Flags: 0x010 (ACK)| 000. .... .... = Reserved: Not set| ...0 .... .... = Nonce: Not set| .... 0... .... = Congestion Window Reduced (CWR): Not set| .... .0.. .... = ECN-Echo: Not set| .... ..0. .... = Urgent: Not set| .... ...1 .... = Acknowledgment: Set| .... .... 0... = Push: Not set| .... .... .0.. = Reset: Not set| .... .... ..0. = Syn: Not set| .... .... ...0 = Fin: Not set| TCP Flags: иииииииAииии| Window: 64240| Calculated window size: 64240| Window size scaling factor: -2 (no window scaling used)| Checksum: 0xd21e [unverified]| Checksum Status: Unverified| Urgent Pointer: 0| SEQ/ACK analysis| This is an ACK to the segment in frame: 17| The RTT to ACK the segment was: 0.000051000 seconds| iRTT: 0.024822000 seconds| Timestamps| Time since first frame in this TCP stream: 0.085183000 seconds| Time since previous frame in this TCP stream: 0.000051000 seconds|
19,1667130235.806731000,192.168.31.246,20.44.239.154,tls,1173, TLSv1.2 Record Layer: Application Data Protocol: http2| Content Type: Application Data (23)| Version: TLS 1.2 (0x0303)| Length: 1114| Encrypted Application Data: 000000000000000206f689fa15bdb2f5d700c48758b1eed55449da5fdffd168cce51a6eaЁ| Application Data Protocol: http2|
20,1667130235.806762000,20.44.239.154,192.168.31.246,tcp,54, Source Port: 443| Destination Port: 49771| Stream index: 0| TCP Segment Len: 0| Sequence Number: 3879    (relative sequence number)| Sequence Number (raw): 1349603119| Next Sequence Number: 3879    (relative sequence number)| Acknowledgment Number: 1581    (relative ack number)| Acknowledgment number (raw): 3428504220| 0101 .... = Header Length: 20 bytes (5)| Flags: 0x010 (ACK)| 000. .... .... = Reserved: Not set| ...0 .... .... = Nonce: Not set| .... 0... .... = Congestion Window Reduced (CWR): Not set| .... .0.. .... = ECN-Echo: Not set| .... ..0. .... = Urgent: Not set| .... ...1 .... = Acknowledgment: Set| .... .... 0... = Push: Not set| .... .... .0.. = Reset: Not set| .... .... ..0. = Syn: Not set| .... .... ...0 = Fin: Not set| TCP Flags: иииииииAииии| Window: 64240| Calculated window size: 64240| Window size scaling factor: -2 (no window scaling used)| Checksum: 0xcdbf [unverified]| Checksum Status: Unverified| Urgent Pointer: 0| SEQ/ACK analysis| This is an ACK to the segment in frame: 19| The RTT to ACK the segment was: 0.000031000 seconds| iRTT: 0.024822000 seconds| Timestamps| Time since first frame in this TCP stream: 0.085273000 seconds| Time since previous frame in this TCP stream: 0.000031000 seconds|
21,1667130235.806862000,192.168.31.246,20.44.239.154,tls,92, TLSv1.2 Record Layer: Application Data Protocol: http2| Content Type: Application Data (23)| Version: TLS 1.2 (0x0303)| Length: 33| Encrypted Application Data: 00000000000000036e3c6731223d1cd413d6b6758d37ae644d40fd05611721183f| Application Data Protocol: http2|
22,1667130235.806874000,20.44.239.154,192.168.31.246,tcp,54, Source Port: 443| Destination Port: 49771| Stream index: 0| TCP Segment Len: 0| Sequence Number: 3879    (relative sequence number)| Sequence Number (raw): 1349603119| Next Sequence Number: 3879    (relative sequence number)| Acknowledgment Number: 1619    (relative ack number)| Acknowledgment number (raw): 3428504258| 0101 .... = Header Length: 20 bytes (5)| Flags: 0x010 (ACK)| 000. .... .... = Reserved: Not set| ...0 .... .... = Nonce: Not set| .... 0... .... = Congestion Window Reduced (CWR): Not set| .... .0.. .... = ECN-Echo: Not set| .... ..0. .... = Urgent: Not set| .... ...1 .... = Acknowledgment: Set| .... .... 0... = Push: Not set| .... .... .0.. = Reset: Not set| .... .... ..0. = Syn: Not set| .... .... ...0 = Fin: Not set| TCP Flags: иииииииAииии| Window: 64240| Calculated window size: 64240| Window size scaling factor: -2 (no window scaling used)| Checksum: 0xcd99 [unverified]| Checksum Status: Unverified| Urgent Pointer: 0| SEQ/ACK analysis| This is an ACK to the segment in frame: 21| The RTT to ACK the segment was: 0.000012000 seconds| iRTT: 0.024822000 seconds| Timestamps| Time since first frame in this TCP stream: 0.085385000 seconds| Time since previous frame in this TCP stream: 0.000012000 seconds|
23,1667130235.830125000,20.44.239.154,192.168.31.246,tls,92, TLSv1.2 Record Layer: Application Data Protocol: http2| Content Type: Application Data (23)| Version: TLS 1.2 (0x0303)| Length: 33| Encrypted Application Data: 0000000000000002ebc71b200fe4a4603831edbc5d89ee07a336c9001908f4e2da| Application Data Protocol: http2|
24,1667130235.854284000,20.44.239.154,192.168.31.246,tls,177, TLSv1.2 Record Layer: Application Data Protocol: http2| Content Type: Application Data (23)| Version: TLS 1.2 (0x0303)| Length: 118| Encrypted Application Data: 0000000000000003b0090e9d00589aba66bebafd9f6612d016e28d91e69f1233539a8dccЁ| Application Data Protocol: http2|
