No,Timestamp,Source,Destination,Protocal,length,info
7,1667181768.808306000,192.168.1.1,192.168.31.246,tcp,54," Source Port: 10051| Destination Port: 49908| Stream index: 0| TCP Segment Len: 0| Sequence Number: 1    (relative sequence number)| Sequence Number (raw): 522979267| Next Sequence Number: 1    (relative sequence number)| Acknowledgment Number: 1    (relative ack number)| Acknowledgment number (raw): 4043552770| 0101 .... = Header Length: 20 bytes (5)| Flags: 0x014 (RST, ACK)| 000. .... .... = Reserved: Not set| ...0 .... .... = Nonce: Not set| .... 0... .... = Congestion Window Reduced (CWR): Not set| .... .0.. .... = ECN-Echo: Not set| .... ..0. .... = Urgent: Not set| .... ...1 .... = Acknowledgment: Set| .... .... 0... = Push: Not set| .... .... .1.. = Reset: Set| Expert Info (Warning/Sequence): Connection reset (RST)| Connection reset (RST)| Severity level: Warning| Group: Sequence| .... .... ..0. = Syn: Not set| .... .... ...0 = Fin: Not set| TCP Flags: иииииииAиRии| Window: 64240| Calculated window size: 64240| Window size scaling factor: -1 (unknown)| Checksum: 0x586a [unverified]| Checksum Status: Unverified| Urgent Pointer: 0| Timestamps| Time since first frame in this TCP stream: 0.000000000 seconds| Time since previous frame in this TCP stream: 0.000000000 seconds|"
8,1667181770.285286000,192.168.31.246,192.168.31.2,dns,75," Transaction ID: 0xe799| Flags: 0x0100 Standard query| 0... .... .... .... = Response: Message is a query| .000 0... .... .... = Opcode: Standard query (0)| .... ..0. .... .... = Truncated: Message is not truncated| .... ...1 .... .... = Recursion desired: Do query recursively| .... .... .0.. .... = Z: reserved (0)| .... .... ...0 .... = Non-authenticated data: Unacceptable| Questions: 1| Answer RRs: 0| Authority RRs: 0| Additional RRs: 0| Queries| Name: cdn.onenote.net| Name Length: 15| Label Count: 3| Type: A (Host Address) (1)| Class: IN (0x0001)| cdn.onenote.net: type A, class IN|"
9,1667181770.374069000,192.168.31.2,192.168.31.246,dns,165," Transaction ID: 0xe799| Flags: 0x8180 Standard query response, No error| 1... .... .... .... = Response: Message is a response| .000 0... .... .... = Opcode: Standard query (0)| .... .0.. .... .... = Authoritative: Server is not an authority for domain| .... ..0. .... .... = Truncated: Message is not truncated| .... ...1 .... .... = Recursion desired: Do query recursively| .... .... 1... .... = Recursion available: Server can do recursive queries| .... .... .0.. .... = Z: reserved (0)| .... .... ..0. .... = Answer authenticated: Answer/authority portion was not authenticated by the server| .... .... ...0 .... = Non-authenticated data: Unacceptable| .... .... .... 0000 = Reply code: No error (0)| Questions: 1| Answer RRs: 3| Authority RRs: 0| Additional RRs: 0| Queries| Name: cdn.onenote.net| Name Length: 15| Label Count: 3| Type: A (Host Address) (1)| Class: IN (0x0001)| Name: cdn.onenote.net| Type: CNAME (Canonical NAME for an alias) (5)| Class: IN (0x0001)| Time to live: 5 (5 seconds)| Data length: 26| CNAME: cdn.onenote.net.edgekey.net| Address: 104.119.252.136| Request In: 8| Time: 0.088783000 seconds| cdn.onenote.net: type A, class IN| Answers| cdn.onenote.net: type CNAME, class IN, cname cdn.onenote.net.edgekey.net| cdn.onenote.net.edgekey.net: type CNAME, class IN, cname e1553.dspg.akamaiedge.net| e1553.dspg.akamaiedge.net: type A, class IN, addr 104.119.252.136| Name: cdn.onenote.net.edgekey.net| Name: e1553.dspg.akamaiedge.net| Type: CNAME (Canonical NAME for an alias) (5)| Type: A (Host Address) (1)| Class: IN (0x0001)| Class: IN (0x0001)| Time to live: 5 (5 seconds)| Time to live: 5 (5 seconds)| Data length: 24| Data length: 4| CNAME: e1553.dspg.akamaiedge.net|"
10,1667181770.378662000,192.168.31.246,104.119.252.136,tcp,66," Source Port: 49909| Destination Port: 443| Stream index: 1| TCP Segment Len: 0| Sequence Number: 0    (relative sequence number)| Sequence Number (raw): 23419240| Next Sequence Number: 1    (relative sequence number)| Acknowledgment Number: 0| Acknowledgment number (raw): 0| 1000 .... = Header Length: 32 bytes (8)| Flags: 0x002 (SYN)| 000. .... .... = Reserved: Not set| ...0 .... .... = Nonce: Not set| .... 0... .... = Congestion Window Reduced (CWR): Not set| .... .0.. .... = ECN-Echo: Not set| .... ..0. .... = Urgent: Not set| .... ...0 .... = Acknowledgment: Not set| .... .... 0... = Push: Not set| .... .... .0.. = Reset: Not set| .... .... ..1. = Syn: Set| Expert Info (Chat/Sequence): Connection establish request (SYN): server port 443| Connection establish request (SYN): server port 443| Severity level: Chat| Group: Sequence| .... .... ...0 = Fin: Not set| TCP Flags: ииииииииииSи| Window: 64240| Calculated window size: 64240| Checksum: 0x0f03 [unverified]| Checksum Status: Unverified| Urgent Pointer: 0| Options: (12 bytes), Maximum segment size, No-Operation (NOP), Window scale, No-Operation (NOP), No-Operation (NOP), SACK permitted| TCP Option - Maximum segment size: 1460 bytes| Kind: Maximum Segment Size (2)| Length: 4| MSS Value: 1460| TCP Option - No-Operation (NOP)| TCP Option - Window scale: 8 (multiply by 256)| Shift count: 8| Multiplier: 256| TCP Option - SACK permitted| Timestamps| Time since first frame in this TCP stream: 0.000000000 seconds| Time since previous frame in this TCP stream: 0.000000000 seconds| Kind: No-Operation (1)| Kind: Window Scale (3)| Kind: No-Operation (1)| Kind: No-Operation (1)| Kind: SACK Permitted (4)| Length: 3| Length: 2| TCP Option - No-Operation (NOP)| TCP Option - No-Operation (NOP)|"
11,1667181770.591972000,104.119.252.136,192.168.31.246,tcp,58," Source Port: 443| Destination Port: 49909| Stream index: 1| TCP Segment Len: 0| Sequence Number: 0    (relative sequence number)| Sequence Number (raw): 1302925350| Next Sequence Number: 1    (relative sequence number)| Acknowledgment Number: 1    (relative ack number)| Acknowledgment number (raw): 23419241| 0110 .... = Header Length: 24 bytes (6)| Flags: 0x012 (SYN, ACK)| 000. .... .... = Reserved: Not set| ...0 .... .... = Nonce: Not set| .... 0... .... = Congestion Window Reduced (CWR): Not set| .... .0.. .... = ECN-Echo: Not set| .... ..0. .... = Urgent: Not set| .... ...1 .... = Acknowledgment: Set| .... .... 0... = Push: Not set| .... .... .0.. = Reset: Not set| .... .... ..1. = Syn: Set| Expert Info (Chat/Sequence): Connection establish acknowledge (SYN+ACK): server port 443| Connection establish acknowledge (SYN+ACK): server port 443| Severity level: Chat| Group: Sequence| .... .... ...0 = Fin: Not set| TCP Flags: иииииииAииSи| Window: 64240| Calculated window size: 64240| Checksum: 0xda38 [unverified]| Checksum Status: Unverified| Urgent Pointer: 0| Options: (4 bytes), Maximum segment size| TCP Option - Maximum segment size: 1460 bytes| Kind: Maximum Segment Size (2)| Length: 4| MSS Value: 1460| SEQ/ACK analysis| This is an ACK to the segment in frame: 10| The RTT to ACK the segment was: 0.213310000 seconds| Timestamps| Time since first frame in this TCP stream: 0.213310000 seconds| Time since previous frame in this TCP stream: 0.213310000 seconds|"
12,1667181770.592209000,192.168.31.246,104.119.252.136,tcp,54, Source Port: 49909| Destination Port: 443| Stream index: 1| TCP Segment Len: 0| Sequence Number: 1    (relative sequence number)| Sequence Number (raw): 23419241| Next Sequence Number: 1    (relative sequence number)| Acknowledgment Number: 1    (relative ack number)| Acknowledgment number (raw): 1302925351| 0101 .... = Header Length: 20 bytes (5)| Flags: 0x010 (ACK)| 000. .... .... = Reserved: Not set| ...0 .... .... = Nonce: Not set| .... 0... .... = Congestion Window Reduced (CWR): Not set| .... .0.. .... = ECN-Echo: Not set| .... ..0. .... = Urgent: Not set| .... ...1 .... = Acknowledgment: Set| .... .... 0... = Push: Not set| .... .... .0.. = Reset: Not set| .... .... ..0. = Syn: Not set| .... .... ...0 = Fin: Not set| TCP Flags: иииииииAииии| Window: 64240| Calculated window size: 64240| Window size scaling factor: -2 (no window scaling used)| Checksum: 0xf1f5 [unverified]| Checksum Status: Unverified| Urgent Pointer: 0| SEQ/ACK analysis| This is an ACK to the segment in frame: 11| The RTT to ACK the segment was: 0.000237000 seconds| iRTT: 0.213547000 seconds| Timestamps| Time since first frame in this TCP stream: 0.213547000 seconds| Time since previous frame in this TCP stream: 0.000237000 seconds|
13,1667181770.592932000,192.168.31.246,104.119.252.136,tls,236," TLSv1.2 Record Layer: Handshake Protocol: Client Hello| Content Type: Handshake (22)| Version: TLS 1.2 (0x0303)| Length: 177| Handshake Protocol: Client Hello| Handshake Type: Client Hello (1)| Length: 173| Version: TLS 1.2 (0x0303)| Random: 635f2cca62ce38bbbfe2fda483f1695ca68688074b02e181dc0bcab1e054d8d8| GMT Unix Time: Oct 31, 2022 09:02:50.000000000 SE Asia Standard Time| Random Bytes: 62ce38bbbfe2fda483f1695ca68688074b02e181dc0bcab1e054d8d8| Session ID Length: 0| Cipher Suites Length: 38| Cipher Suites (19 suites)| Cipher Suite: TLS_ECDHE_ECDSA_WITH_AES_256_GCM_SHA384 (0xc02c)| Compression Methods Length: 1| Compression Methods (1 method)| Compression Method: null (0)| Extensions Length: 94| Extension: server_name (len=20)| Type: server_name (0)| Length: 20| Server Name list length: 18| Server Name Type: host_name (0)| Server Name length: 15| Server Name: cdn.onenote.net| Certificate Status Type: OCSP (1)| Responder ID list Length: 0| Request Extensions Length: 0| Supported Groups List Length: 6| Supported Groups (3 groups)| Supported Group: x25519 (0x001d)| EC point formats Length: 1| Elliptic curves point formats (1)| EC point format: uncompressed (0)| Signature Hash Algorithms Length: 24| Signature Hash Algorithms (12 algorithms)| Signature Algorithm: rsa_pss_rsae_sha256 (0x0804)| Signature Hash Algorithm Hash: Unknown (8)| Signature Hash Algorithm Signature: Unknown (4)| Data (0 bytes)| Renegotiation info extension length: 0| Cipher Suite: TLS_ECDHE_ECDSA_WITH_AES_128_GCM_SHA256 (0xc02b)| Cipher Suite: TLS_ECDHE_RSA_WITH_AES_256_GCM_SHA384 (0xc030)| Cipher Suite: TLS_ECDHE_RSA_WITH_AES_128_GCM_SHA256 (0xc02f)| Cipher Suite: TLS_ECDHE_ECDSA_WITH_AES_256_CBC_SHA384 (0xc024)| Cipher Suite: TLS_ECDHE_ECDSA_WITH_AES_128_CBC_SHA256 (0xc023)| Cipher Suite: TLS_ECDHE_RSA_WITH_AES_256_CBC_SHA384 (0xc028)| Cipher Suite: TLS_ECDHE_RSA_WITH_AES_128_CBC_SHA256 (0xc027)| Cipher Suite: TLS_ECDHE_ECDSA_WITH_AES_256_CBC_SHA (0xc00a)| Cipher Suite: TLS_ECDHE_ECDSA_WITH_AES_128_CBC_SHA (0xc009)| Cipher Suite: TLS_ECDHE_RSA_WITH_AES_256_CBC_SHA (0xc014)| Cipher Suite: TLS_ECDHE_RSA_WITH_AES_128_CBC_SHA (0xc013)| Cipher Suite: TLS_RSA_WITH_AES_256_GCM_SHA384 (0x009d)| Cipher Suite: TLS_RSA_WITH_AES_128_GCM_SHA256 (0x009c)| Cipher Suite: TLS_RSA_WITH_AES_256_CBC_SHA256 (0x003d)| Cipher Suite: TLS_RSA_WITH_AES_128_CBC_SHA256 (0x003c)| Cipher Suite: TLS_RSA_WITH_AES_256_CBC_SHA (0x0035)| Cipher Suite: TLS_RSA_WITH_AES_128_CBC_SHA (0x002f)| Cipher Suite: TLS_RSA_WITH_3DES_EDE_CBC_SHA (0x000a)| Server Name Indication extension| Extension: status_request (len=5)| Extension: supported_groups (len=8)| Extension: ec_point_formats (len=2)| Extension: signature_algorithms (len=26)| Extension: session_ticket (len=0)| Extension: extended_master_secret (len=0)| Extension: renegotiation_info (len=1)| Renegotiation Info extension| Type: status_request (5)| Type: supported_groups (10)| Type: ec_point_formats (11)| Type: signature_algorithms (13)| Type: session_ticket (35)| Type: extended_master_secret (23)| Type: renegotiation_info (65281)| Length: 5| Length: 8| Length: 2| Length: 26| Length: 0| Length: 0| Length: 1| Supported Group: secp256r1 (0x0017)| Supported Group: secp384r1 (0x0018)| Signature Algorithm: rsa_pss_rsae_sha384 (0x0805)| Signature Algorithm: rsa_pss_rsae_sha512 (0x0806)| Signature Algorithm: rsa_pkcs1_sha256 (0x0401)| Signature Algorithm: rsa_pkcs1_sha384 (0x0501)| Signature Algorithm: rsa_pkcs1_sha1 (0x0201)| Signature Algorithm: ecdsa_secp256r1_sha256 (0x0403)| Signature Algorithm: ecdsa_secp384r1_sha384 (0x0503)| Signature Algorithm: ecdsa_sha1 (0x0203)| Signature Algorithm: SHA1 DSA (0x0202)| Signature Algorithm: rsa_pkcs1_sha512 (0x0601)| Signature Algorithm: ecdsa_secp521r1_sha512 (0x0603)| Signature Hash Algorithm Hash: Unknown (8)| Signature Hash Algorithm Hash: Unknown (8)| Signature Hash Algorithm Hash: SHA256 (4)| Signature Hash Algorithm Hash: SHA384 (5)| Signature Hash Algorithm Hash: SHA1 (2)| Signature Hash Algorithm Hash: SHA256 (4)| Signature Hash Algorithm Hash: SHA384 (5)| Signature Hash Algorithm Hash: SHA1 (2)| Signature Hash Algorithm Hash: SHA1 (2)| Signature Hash Algorithm Hash: SHA512 (6)| Signature Hash Algorithm Hash: SHA512 (6)| Signature Hash Algorithm Signature: Unknown (5)| Signature Hash Algorithm Signature: Unknown (6)| Signature Hash Algorithm Signature: RSA (1)| Signature Hash Algorithm Signature: RSA (1)| Signature Hash Algorithm Signature: RSA (1)| Signature Hash Algorithm Signature: ECDSA (3)| Signature Hash Algorithm Signature: ECDSA (3)| Signature Hash Algorithm Signature: ECDSA (3)| Signature Hash Algorithm Signature: DSA (2)| Signature Hash Algorithm Signature: RSA (1)| Signature Hash Algorithm Signature: ECDSA (3)|"
14,1667181770.593096000,104.119.252.136,192.168.31.246,tcp,54, Source Port: 443| Destination Port: 49909| Stream index: 1| TCP Segment Len: 0| Sequence Number: 1    (relative sequence number)| Sequence Number (raw): 1302925351| Next Sequence Number: 1    (relative sequence number)| Acknowledgment Number: 183    (relative ack number)| Acknowledgment number (raw): 23419423| 0101 .... = Header Length: 20 bytes (5)| Flags: 0x010 (ACK)| 000. .... .... = Reserved: Not set| ...0 .... .... = Nonce: Not set| .... 0... .... = Congestion Window Reduced (CWR): Not set| .... .0.. .... = ECN-Echo: Not set| .... ..0. .... = Urgent: Not set| .... ...1 .... = Acknowledgment: Set| .... .... 0... = Push: Not set| .... .... .0.. = Reset: Not set| .... .... ..0. = Syn: Not set| .... .... ...0 = Fin: Not set| TCP Flags: иииииииAииии| Window: 64240| Calculated window size: 64240| Window size scaling factor: -2 (no window scaling used)| Checksum: 0xf13f [unverified]| Checksum Status: Unverified| Urgent Pointer: 0| SEQ/ACK analysis| This is an ACK to the segment in frame: 13| The RTT to ACK the segment was: 0.000164000 seconds| iRTT: 0.213547000 seconds| Timestamps| Time since first frame in this TCP stream: 0.214434000 seconds| Time since previous frame in this TCP stream: 0.000164000 seconds|
15,1667181770.806948000,104.119.252.136,192.168.31.246,tls,1452," TLSv1.2 Record Layer: Handshake Protocol: Server Hello| Content Type: Handshake (22)| Version: TLS 1.2 (0x0303)| Length: 69| Handshake Protocol: Server Hello| Handshake Type: Server Hello (2)| Length: 65| Version: TLS 1.2 (0x0303)| Random: 121f43cda1df9f384310ec3c7fc52b768fcf7eda1c32f0eb444f574e47524401| GMT Unix Time: Aug 21, 1979 06:14:21.000000000 SE Asia Standard Time| Random Bytes: a1df9f384310ec3c7fc52b768fcf7eda1c32f0eb444f574e47524401| Session ID Length: 0| Cipher Suite: TLS_ECDHE_RSA_WITH_AES_256_GCM_SHA384 (0xc030)| Compression Method: null (0)| Extensions Length: 25| Extension: renegotiation_info (len=1)| Type: renegotiation_info (65281)| Length: 1| Renegotiation info extension length: 0| EC point formats Length: 3| Elliptic curves point formats (3)| EC point format: uncompressed (0)| Data (0 bytes)| Renegotiation Info extension| Extension: server_name (len=0)| Extension: ec_point_formats (len=4)| Extension: session_ticket (len=0)| Extension: status_request (len=0)| Type: server_name (0)| Type: ec_point_formats (11)| Type: session_ticket (35)| Type: status_request (5)| Length: 0| Length: 4| Length: 0| Length: 0| EC point format: ansiX962_compressed_prime (1)| EC point format: ansiX962_compressed_char2 (2)|"
16,1667181770.807654000,104.119.252.136,192.168.31.246,tcp,1514, Source Port: 443| Destination Port: 49909| Stream index: 1| TCP Segment Len: 1460| Sequence Number: 1399    (relative sequence number)| Sequence Number (raw): 1302926749| Next Sequence Number: 2859    (relative sequence number)| Acknowledgment Number: 183    (relative ack number)| Acknowledgment number (raw): 23419423| 0101 .... = Header Length: 20 bytes (5)| Flags: 0x010 (ACK)| 000. .... .... = Reserved: Not set| ...0 .... .... = Nonce: Not set| .... 0... .... = Congestion Window Reduced (CWR): Not set| .... .0.. .... = ECN-Echo: Not set| .... ..0. .... = Urgent: Not set| .... ...1 .... = Acknowledgment: Set| .... .... 0... = Push: Not set| .... .... .0.. = Reset: Not set| .... .... ..0. = Syn: Not set| .... .... ...0 = Fin: Not set| TCP Flags: иииииииAииии| Window: 64240| Calculated window size: 64240| Window size scaling factor: -2 (no window scaling used)| Checksum: 0x42e9 [unverified]| Checksum Status: Unverified| Urgent Pointer: 0| SEQ/ACK analysis| iRTT: 0.213547000 seconds| Bytes in flight: 2858| Bytes sent since last PSH flag: 1460| Timestamps| Time since first frame in this TCP stream: 0.428992000 seconds| Time since previous frame in this TCP stream: 0.000706000 seconds| TCP payload (1460 bytes)| TCP segment data (1460 bytes)|
