No,Timestamp,Source,Destination,Protocal,length,info
1,1667181729.921878000,192.168.31.123,192.168.31.255,dhcp,324, Message type: Boot Request (1)| Hardware type: Ethernet (0x01)| Hardware address length: 6| Hops: 0| Transaction ID: 0x19f66774| Seconds elapsed: 1| Bootp flags: 0x0000 (Unicast)| 0... .... .... .... = Broadcast flag: Unicast| .000 0000 0000 0000 = Reserved flags: 0x0000| Client IP address: 192.168.31.123| Your (client) IP address: 0.0.0.0| Next server IP address: 0.0.0.0| Relay agent IP address: 0.0.0.0| Client MAC address: 00:0c:29:26:1a:fe| Client hardware address padding: 00000000000000000000| Server host name not given| Boot file name not given| Magic cookie: DHCP| Option: (53) DHCP Message Type (Request)| Length: 1| DHCP: Request (3)| Parameter Request List Item: (1) Subnet Mask| Maximum DHCP Message Size: 65535| Host Name: kali| Option End: 255| Hardware type: Ethernet (0x01)| Client MAC address: 00:0c:29:26:1a:fe| Option: (61) Client identifier| Option: (55) Parameter Request List| Option: (57) Maximum DHCP Message Size| Option: (12) Host Name| Option: (255) End| Length: 7| Length: 17| Length: 2| Length: 4| Parameter Request List Item: (2) Time Offset| Parameter Request List Item: (6) Domain Name Server| Parameter Request List Item: (12) Host Name| Parameter Request List Item: (15) Domain Name| Parameter Request List Item: (26) Interface MTU| Parameter Request List Item: (28) Broadcast Address| Parameter Request List Item: (121) Classless Static Route| Parameter Request List Item: (3) Router| Parameter Request List Item: (33) Static Route| Parameter Request List Item: (40) Network Information Service Domain| Parameter Request List Item: (41) Network Information Service Servers| Parameter Request List Item: (42) Network Time Protocol Servers| Parameter Request List Item: (119) Domain Search| Parameter Request List Item: (249) Private/Classless Static Route (Microsoft)| Parameter Request List Item: (252) Private/Proxy autodiscovery| Parameter Request List Item: (17) Root Path|
2,1667181729.922071000,192.168.31.255,192.168.31.123,dhcp,342, Message type: Boot Reply (2)| Hardware type: Ethernet (0x01)| Hardware address length: 6| Hops: 0| Transaction ID: 0x19f66774| Seconds elapsed: 1| Bootp flags: 0x0000 (Unicast)| 0... .... .... .... = Broadcast flag: Unicast| .000 0000 0000 0000 = Reserved flags: 0x0000| Client IP address: 192.168.31.123| Your (client) IP address: 192.168.31.123| Next server IP address: 192.168.31.255| Relay agent IP address: 0.0.0.0| Client MAC address: 00:0c:29:26:1a:fe| Client hardware address padding: 00000000000000000000| Server host name not given| Boot file name not given| Magic cookie: DHCP| Option: (53) DHCP Message Type (ACK)| Length: 1| DHCP: ACK (5)| DHCP Server Identifier: 192.168.31.255| IP Address Lease Time: (1800s) 30 minutes| Subnet Mask: 255.255.255.0| Domain Name Server: 192.168.31.2| Domain Name: localdomain| Broadcast Address: 192.168.31.255| Router: 192.168.31.2| Option End: 255| Padding: 00000000000000| Option: (54) DHCP Server Identifier (192.168.31.255)| Option: (51) IP Address Lease Time| Option: (1) Subnet Mask (255.255.255.0)| Option: (6) Domain Name Server| Option: (15) Domain Name| Option: (28) Broadcast Address (192.168.31.255)| Option: (3) Router| Option: (255) End| Length: 4| Length: 4| Length: 4| Length: 4| Length: 11| Length: 4| Length: 4|
5,1667181740.747594000,192.168.31.246,172.217.161.67,tls,55,
6,1667181740.747617000,172.217.161.67,192.168.31.246,tcp,54, Source Port: 443| Destination Port: 49886| Stream index: 0| TCP Segment Len: 0| Sequence Number: 1    (relative sequence number)| Sequence Number (raw): 500002212| Next Sequence Number: 1    (relative sequence number)| Acknowledgment Number: 2    (relative ack number)| Acknowledgment number (raw): 3002508952| 0101 .... = Header Length: 20 bytes (5)| Flags: 0x010 (ACK)| 000. .... .... = Reserved: Not set| ...0 .... .... = Nonce: Not set| .... 0... .... = Congestion Window Reduced (CWR): Not set| .... .0.. .... = ECN-Echo: Not set| .... ..0. .... = Urgent: Not set| .... ...1 .... = Acknowledgment: Set| .... .... 0... = Push: Not set| .... .... .0.. = Reset: Not set| .... .... ..0. = Syn: Not set| .... .... ...0 = Fin: Not set| TCP Flags: иииииииAииии| Window: 64240| Calculated window size: 64240| Window size scaling factor: -1 (unknown)| Checksum: 0xdc8d [unverified]| Checksum Status: Unverified| Urgent Pointer: 0| SEQ/ACK analysis| This is an ACK to the segment in frame: 5| The RTT to ACK the segment was: 0.000023000 seconds| Timestamps| Time since first frame in this TCP stream: 0.000023000 seconds| Time since previous frame in this TCP stream: 0.000023000 seconds|
13,1667181747.795600000,192.168.31.246,192.168.1.1,tcp,66," Source Port: 49908| Destination Port: 10051| Stream index: 1| TCP Segment Len: 0| Sequence Number: 0    (relative sequence number)| Sequence Number (raw): 4043552769| Next Sequence Number: 1    (relative sequence number)| Acknowledgment Number: 0| Acknowledgment number (raw): 0| 1000 .... = Header Length: 32 bytes (8)| Flags: 0x002 (SYN)| 000. .... .... = Reserved: Not set| ...0 .... .... = Nonce: Not set| .... 0... .... = Congestion Window Reduced (CWR): Not set| .... .0.. .... = ECN-Echo: Not set| .... ..0. .... = Urgent: Not set| .... ...0 .... = Acknowledgment: Not set| .... .... 0... = Push: Not set| .... .... .0.. = Reset: Not set| .... .... ..1. = Syn: Set| Expert Info (Chat/Sequence): Connection establish request (SYN): server port 10051| Connection establish request (SYN): server port 10051| Severity level: Chat| Group: Sequence| .... .... ...0 = Fin: Not set| TCP Flags: ииииииииииSи| Window: 64240| Calculated window size: 64240| Checksum: 0x3e9a [unverified]| Checksum Status: Unverified| Urgent Pointer: 0| Options: (12 bytes), Maximum segment size, No-Operation (NOP), Window scale, No-Operation (NOP), No-Operation (NOP), SACK permitted| TCP Option - Maximum segment size: 1460 bytes| Kind: Maximum Segment Size (2)| Length: 4| MSS Value: 1460| TCP Option - No-Operation (NOP)| TCP Option - Window scale: 8 (multiply by 256)| Shift count: 8| Multiplier: 256| TCP Option - SACK permitted| Timestamps| Time since first frame in this TCP stream: 0.000000000 seconds| Time since previous frame in this TCP stream: 0.000000000 seconds| Kind: No-Operation (1)| Kind: Window Scale (3)| Kind: No-Operation (1)| Kind: No-Operation (1)| Kind: SACK Permitted (4)| Length: 3| Length: 2| TCP Option - No-Operation (NOP)| TCP Option - No-Operation (NOP)|"
14,1667181748.796942000,192.168.31.246,192.168.1.1,tcp,66," Source Port: 49908| Destination Port: 10051| Stream index: 1| TCP Segment Len: 0| Sequence Number: 0    (relative sequence number)| Sequence Number (raw): 4043552769| Next Sequence Number: 1    (relative sequence number)| Acknowledgment Number: 0| Acknowledgment number (raw): 0| 1000 .... = Header Length: 32 bytes (8)| Flags: 0x002 (SYN)| 000. .... .... = Reserved: Not set| ...0 .... .... = Nonce: Not set| .... 0... .... = Congestion Window Reduced (CWR): Not set| .... .0.. .... = ECN-Echo: Not set| .... ..0. .... = Urgent: Not set| .... ...0 .... = Acknowledgment: Not set| .... .... 0... = Push: Not set| .... .... .0.. = Reset: Not set| .... .... ..1. = Syn: Set| Expert Info (Chat/Sequence): Connection establish request (SYN): server port 10051| Connection establish request (SYN): server port 10051| Severity level: Chat| Group: Sequence| .... .... ...0 = Fin: Not set| TCP Flags: ииииииииииSи| Window: 64240| Calculated window size: 64240| Checksum: 0x3e9a [unverified]| Checksum Status: Unverified| Urgent Pointer: 0| Options: (12 bytes), Maximum segment size, No-Operation (NOP), Window scale, No-Operation (NOP), No-Operation (NOP), SACK permitted| TCP Option - Maximum segment size: 1460 bytes| Kind: Maximum Segment Size (2)| Length: 4| MSS Value: 1460| TCP Option - No-Operation (NOP)| TCP Option - Window scale: 8 (multiply by 256)| Shift count: 8| Multiplier: 256| TCP Option - SACK permitted| SEQ/ACK analysis| TCP Analysis Flags| This frame is a (suspected) retransmission| The RTO for this segment was: 1.001342000 seconds| RTO based on delta from frame: 13| Timestamps| Time since first frame in this TCP stream: 1.001342000 seconds| Time since previous frame in this TCP stream: 1.001342000 seconds| Expert Info (Note/Sequence): This frame is a (suspected) retransmission| Severity level: Note| Group: Sequence| Kind: No-Operation (1)| Kind: Window Scale (3)| Kind: No-Operation (1)| Kind: No-Operation (1)| Kind: SACK Permitted (4)| Length: 3| Length: 2| TCP Option - No-Operation (NOP)| TCP Option - No-Operation (NOP)|"
